<xs:schema elementFormDefault="qualified"
           xmlns:xs="http://www.w3.org/2001/XMLSchema">
    <xs:element name="products">
        <xs:complexType>
            <xs:sequence>
                <xs:element name="category" maxOccurs="unbounded" minOccurs="0">
                    <xs:complexType>
                        <xs:sequence>
                            <xs:element name="subcategory" maxOccurs="unbounded" minOccurs="0">
                                <xs:complexType>
                                    <xs:sequence>
                                        <xs:element name="product" maxOccurs="unbounded" minOccurs="0">
                                            <xs:complexType>
                                                <xs:sequence>
                                                    <xs:element name="brand">
                                                        <xs:simpleType>
                                                            <xs:restriction base="xs:string">
                                                                <xs:enumeration value="ACER"/>
                                                                <xs:enumeration value="DELL"/>
                                                                <xs:enumeration value="HP"/>
                                                                <xs:enumeration value="ASUS"/>
                                                                <xs:enumeration value="DLINK"/>
                                                            </xs:restriction>
                                                        </xs:simpleType>
                                                    </xs:element>
                                                    <xs:element type="xs:string" name="model"/>
                                                    <xs:element type="xs:date" name="dateOfManufacture"/>
                                                    <xs:element name="color">
                                                        <xs:simpleType>
                                                            <xs:restriction base="xs:string">
                                                                <xs:enumeration value="BLACK"/>
                                                                <xs:enumeration value="WHITE"/>
                                                            </xs:restriction>
                                                        </xs:simpleType>
                                                    </xs:element>
                                                    <xs:element type="xs:decimal" name="price"/>
                                                    <xs:element type="xs:integer" name="quantity" maxOccurs="unbounded" minOccurs="0"/>
                                                </xs:sequence>
                                            </xs:complexType>
                                        </xs:element>
                                    </xs:sequence>
                                    <xs:attribute type="xs:string" name="title" use="required"/>
                                </xs:complexType>
                            </xs:element>
                        </xs:sequence>
                        <xs:attribute type="xs:integer" name="id" use="required"/>
                        <xs:attribute type="xs:string" name="title" use="required"/>
                    </xs:complexType>
                </xs:element>
            </xs:sequence>
        </xs:complexType>
    </xs:element>
</xs:schema>